<subjects xmlns:xsi="http://www.w3.org/2001/XMLSchema-instance" xsi:noNamespaceSchemaLocation="xsd/subjects.xsd">
  <subject id="1">
    <ic/>
    <name>Nezařazené</name>
    <address>
      <street/>
      <number/>
      <city/>
      <country/>
    </address>
    <description/>
  </subject>
</subjects>