<?xml version="1.0" encoding="UTF-8"?>
<subjects
    xmlns:xsi="http://www.w3.org/2001/XMLSchema-instance"
    xsi:noNamespaceSchemaLocation="subjects.xsd"
>
  <subject id="1">
    <ic>36178429</ic>
    <name>Gazprom</name>
    <address>
      <street>Vasilevskaya ulica</street>
      <number>1/A</number>
      <city>Moskva</city>
      <country>Ruská federácia</country>
    </address>
    <description>Distribútor plynu</description>
  </subject>
</subjects>